Ollie's Superfood Smoothie Mix,Dietary Supplements,29.99,1000
Functions: Also known as First Class Objects by Ron,Books,19.99,1500
Tom's Superchill Coding For Beginners,Videos,9.99,1500
Painting With Arnab,Videos,15.99,1000
How to Start Debates and Arguments Online and IRL by Drei,Books,29.99,1000
Will's Luxiourous Coif for Men Vitamin Blend,Dietary Supplements,29.99,2000
As Seen On Chapelle's Show: The Wrap-It-Up Box,Electronics,29.99,1000
Misanthrope Brand Commuter Headphones,Electronics,59.99,2000